{
  "accounts": [
    {
      "email": "shopper1.9301@example.test",
      "full_name": "Test Shopper 1",
      "id": "user_foundry_wholesale_9301_1",
      "password": "Variant9301Test1!",
      "verified": true
    },
    {
      "email": "shopper2.9301@example.test",
      "full_name": "Test Shopper 2",
      "id": "user_foundry_wholesale_9301_2",
      "password": "Variant9301Test2!",
      "verified": true
    },
    {
      "email": "shopper3.9301@example.test",
      "full_name": "Test Shopper 3",
      "id": "user_foundry_wholesale_9301_3",
      "password": "Variant9301Test3!",
      "verified": true
    },
    {
      "email": "shopper4.9301@example.test",
      "full_name": "Test Shopper 4",
      "id": "user_foundry_wholesale_9301_4",
      "password": "Variant9301Test4!",
      "verified": true
    }
  ],
  "catalog": {
    "categories": [
      {
        "description": "Browse the Fasteners collection and its variant-specific purchase rules.",
        "id": "cat_fasteners",
        "image": {
          "accent": "#7aefc9",
          "background": "#7223f9",
          "key": "category-fasteners-9301",
          "kind": "generated-svg"
        },
        "name": "Fasteners",
        "slug": "fasteners"
      },
      {
        "description": "Browse the Abrasives collection and its variant-specific purchase rules.",
        "id": "cat_abrasives",
        "image": {
          "accent": "#b6652b",
          "background": "#827758",
          "key": "category-abrasives-9301",
          "kind": "generated-svg"
        },
        "name": "Abrasives",
        "slug": "abrasives"
      },
      {
        "description": "Browse the Safety collection and its variant-specific purchase rules.",
        "id": "cat_safety",
        "image": {
          "accent": "#de20fe",
          "background": "#a16e40",
          "key": "category-safety-9301",
          "kind": "generated-svg"
        },
        "name": "Safety",
        "slug": "safety"
      },
      {
        "description": "Browse the Electrical collection and its variant-specific purchase rules.",
        "id": "cat_electrical",
        "image": {
          "accent": "#aebe8f",
          "background": "#b44465",
          "key": "category-electrical-9301",
          "kind": "generated-svg"
        },
        "name": "Electrical",
        "slug": "electrical"
      },
      {
        "description": "Browse the Plumbing collection and its variant-specific purchase rules.",
        "id": "cat_plumbing",
        "image": {
          "accent": "#9696e6",
          "background": "#4fb4b4",
          "key": "category-plumbing-9301",
          "kind": "generated-svg"
        },
        "name": "Plumbing",
        "slug": "plumbing"
      },
      {
        "description": "Browse the Tools collection and its variant-specific purchase rules.",
        "id": "cat_tools",
        "image": {
          "accent": "#312c0c",
          "background": "#c5f1a2",
          "key": "category-tools-9301",
          "kind": "generated-svg"
        },
        "name": "Tools",
        "slug": "tools"
      },
      {
        "description": "Browse the Packaging collection and its variant-specific purchase rules.",
        "id": "cat_packaging",
        "image": {
          "accent": "#2c87a4",
          "background": "#67afdc",
          "key": "category-packaging-9301",
          "kind": "generated-svg"
        },
        "name": "Packaging",
        "slug": "packaging"
      },
      {
        "description": "Browse the Facility collection and its variant-specific purchase rules.",
        "id": "cat_facility",
        "image": {
          "accent": "#94c1d3",
          "background": "#6f72c8",
          "key": "category-facility-9301",
          "kind": "generated-svg"
        },
        "name": "Facility",
        "slug": "facility"
      }
    ],
    "products": [
      {
        "brand": "Foundry Supply",
        "category_id": "cat_fasteners",
        "compare_at_cents": null,
        "description": "A deterministic bolt kit for testing catalog, cart, checkout, inventory, persistence, and ordering behavior.",
        "featured_rank": 1,
        "id": "prod_foundry_wholesale_01",
        "image": {
          "accent": "#42e883",
          "background": "#2be5a0",
          "key": "product-foundry_wholesale_01-9301",
          "kind": "generated-svg"
        },
        "inventory": 33,
        "price_cents": 1985,
        "rating_basis_points": 440,
        "review_count": 306,
        "sku": "FOU-9301-001",
        "slug": "bolt-kit-1",
        "tags": [
          "fasteners",
          "bolt-kit",
          "foundry-wholesale"
        ],
        "title": "Bolt Kit 1"
      },
      {
        "brand": "Foundry Supply",
        "category_id": "cat_abrasives",
        "compare_at_cents": null,
        "description": "A deterministic grinding disc for testing catalog, cart, checkout, inventory, persistence, and ordering behavior.",
        "featured_rank": 2,
        "id": "prod_foundry_wholesale_02",
        "image": {
          "accent": "#90700e",
          "background": "#853d78",
          "key": "product-foundry_wholesale_02-9301",
          "kind": "generated-svg"
        },
        "inventory": 34,
        "price_cents": 2122,
        "rating_basis_points": 447,
        "review_count": 607,
        "sku": "FOU-9301-002",
        "slug": "grinding-disc-2",
        "tags": [
          "abrasives",
          "grinding-disc",
          "foundry-wholesale"
        ],
        "title": "Grinding Disc 2"
      },
      {
        "brand": "Foundry Supply",
        "category_id": "cat_safety",
        "compare_at_cents": null,
        "description": "A deterministic safety glove for testing catalog, cart, checkout, inventory, persistence, and ordering behavior.",
        "featured_rank": 3,
        "id": "prod_foundry_wholesale_03",
        "image": {
          "accent": "#833678",
          "background": "#72d85a",
          "key": "product-foundry_wholesale_03-9301",
          "kind": "generated-svg"
        },
        "inventory": 35,
        "price_cents": 2259,
        "rating_basis_points": 454,
        "review_count": 8,
        "sku": "FOU-9301-003",
        "slug": "safety-glove-3",
        "tags": [
          "safety",
          "safety-glove",
          "foundry-wholesale"
        ],
        "title": "Safety Glove 3"
      },
      {
        "brand": "Foundry Supply",
        "category_id": "cat_electrical",
        "compare_at_cents": null,
        "description": "A deterministic cable reel for testing catalog, cart, checkout, inventory, persistence, and ordering behavior.",
        "featured_rank": 4,
        "id": "prod_foundry_wholesale_04",
        "image": {
          "accent": "#baedc7",
          "background": "#c133e7",
          "key": "product-foundry_wholesale_04-9301",
          "kind": "generated-svg"
        },
        "inventory": 36,
        "price_cents": 2396,
        "rating_basis_points": 461,
        "review_count": 309,
        "sku": "FOU-9301-004",
        "slug": "cable-reel-4",
        "tags": [
          "electrical",
          "cable-reel",
          "foundry-wholesale"
        ],
        "title": "Cable Reel 4"
      },
      {
        "brand": "Foundry Supply",
        "category_id": "cat_plumbing",
        "compare_at_cents": null,
        "description": "A deterministic valve set for testing catalog, cart, checkout, inventory, persistence, and ordering behavior.",
        "featured_rank": 5,
        "id": "prod_foundry_wholesale_05",
        "image": {
          "accent": "#2e60fb",
          "background": "#abb7c1",
          "key": "product-foundry_wholesale_05-9301",
          "kind": "generated-svg"
        },
        "inventory": 37,
        "price_cents": 2533,
        "rating_basis_points": 468,
        "review_count": 610,
        "sku": "FOU-9301-005",
        "slug": "valve-set-5",
        "tags": [
          "plumbing",
          "valve-set",
          "foundry-wholesale"
        ],
        "title": "Valve Set 5"
      },
      {
        "brand": "Foundry Supply",
        "category_id": "cat_tools",
        "compare_at_cents": null,
        "description": "A deterministic driver bit for testing catalog, cart, checkout, inventory, persistence, and ordering behavior.",
        "featured_rank": 6,
        "id": "prod_foundry_wholesale_06",
        "image": {
          "accent": "#8cfc37",
          "background": "#2138b2",
          "key": "product-foundry_wholesale_06-9301",
          "kind": "generated-svg"
        },
        "inventory": 38,
        "price_cents": 2670,
        "rating_basis_points": 475,
        "review_count": 11,
        "sku": "FOU-9301-006",
        "slug": "driver-bit-6",
        "tags": [
          "tools",
          "driver-bit",
          "foundry-wholesale"
        ],
        "title": "Driver Bit 6"
      },
      {
        "brand": "Foundry Supply",
        "category_id": "cat_packaging",
        "compare_at_cents": null,
        "description": "A deterministic shipping carton for testing catalog, cart, checkout, inventory, persistence, and ordering behavior.",
        "featured_rank": 7,
        "id": "prod_foundry_wholesale_07",
        "image": {
          "accent": "#44995b",
          "background": "#916e7c",
          "key": "product-foundry_wholesale_07-9301",
          "kind": "generated-svg"
        },
        "inventory": 39,
        "price_cents": 2807,
        "rating_basis_points": 482,
        "review_count": 312,
        "sku": "FOU-9301-007",
        "slug": "shipping-carton-7",
        "tags": [
          "packaging",
          "shipping-carton",
          "foundry-wholesale"
        ],
        "title": "Shipping Carton 7"
      },
      {
        "brand": "Foundry Supply",
        "category_id": "cat_facility",
        "compare_at_cents": null,